Description,URL,Price
New 2020 CES Amazfit T-rex T rex Smartwatch 5ATM 14 Sports Modes Smart Watch GPS/GLONASS AMOLED Screen for Xiaomi iOS Android,https://www.aliexpress.com/item/4000622611298.html,149.99
2020 Amazfit T-rex Sport Smart Watch 14 Sports Modes 4 Sensors 5ATM 20days Battery MIL-STD Amazfit T rex GPS Mans Smart Watch,https://www.aliexpress.com/item/4000688753161.html,149.99
New 2020 CES Amazfit T-rex T rex Smartwatch 5ATM 14 Sports Modes Smart Watch GPS/GLONASS MIL-STD for Xiaomi iOS Android,https://www.aliexpress.com/item/4000757485056.html,149.99
Global version Amazfit Stratos 3 GPS smartwatch 5ATM Bluetooth Music Heart Rate DualMode 14DaysBattery 1.34 inch for IOS Andriod,https://www.aliexpress.com/item/4000510084843.html,219.99
Huami Amazfit T-rex Smartwatch 5ATM Heat Cold Resistant MIL-STD Smart Watch GPS/GLONASS AMOLED Screen for Xiaomi iOS Android,https://www.aliexpress.com/item/4000692822630.html,149.99
In Stock Global Version HUAWEI Watch GT 2 GT2 GPS 14 Days Working Waterproof Phone Smart Call Heart Rate Tracker For Android iOS,https://www.aliexpress.com/item/4000221564936.html,169.99
[Free QCY] [IN Stock] Global Version Huami AMAZFIT Stratos 3 GPS 5ATM Waterproof Smart Sports Watch 512MB/4GB Smartwatch,https://www.aliexpress.com/item/4000591038195.html,220.03
In Stock Amazfit T-Rex Global Version Huami Smartwatch GPS 20days Battery Life HeartRate 14 Sport Mode 5ATM Multi-Language,https://www.aliexpress.com/item/4000717621676.html,149.99
In Stock Amazfit T-Rex Global Version Smartwatch 20 days Battery Life GPS 14 Sport Mode Professional Waterproof Android iOS,https://www.aliexpress.com/item/4000717658409.html,149.99
Stock Xiaomi Mi Smart Watch Color NFC 1.39' AMOLED Multi-dial Bracelet Long BatteryWristwatch Sport Fitness Heart Rate Mi Watch,https://www.aliexpress.com/item/4000595549987.html,138.88
For Huami Amazfit T-Rex Tempered Glass for 2020 Amazfit T rex Screen Protector Film Glasses Smart Watch Protective accessories,https://www.aliexpress.com/item/4000602957593.html,1.69
"KOSPET Prime 3GB 32GB Smart Watch Men 1260mAh Battery Dual Camera Face ID unclok 1.6"" 4G Android smartwatch GPS WiFI sim card",https://www.aliexpress.com/item/4000262465934.html,149.99
In Stock Global Version HUAWEI Watch GT Smart Watch 1.39'' AMOLED Screen 14 Days Battery Life 5ATM Waterproof Heart Rate Tracker,https://www.aliexpress.com/item/4000165398310.html,109.28
Global Version Amazfit GTR 47mm Smartwatch 5ATM Waterproof Smartwatch Battery Life 24 Days GPS Music Control With Leather Strap,https://www.aliexpress.com/item/4000080675255.html,149.99
New KOSPET Prime SE 1GB 16GB Android Smart Watch 1260mAh 1.6inch Face ID Unclok 4G Smartwatch Men For Xiaomi Android IOS Phone,https://www.aliexpress.com/item/4000631120868.html,102.66
Xiaomi TicWatch S2 Smart Watch Outdoor Sports Smartwatch Heart Rate Monitor Life Waterproof GPS Self-prompted Sports Tracking,https://www.aliexpress.com/item/4000077085902.html,179.00
New xiaomi mija outdoor Double display digital watch Original imported movement Multi-function dial Dual time display waterproof,https://www.aliexpress.com/item/33029515013.html,17.93
Tempered Glass Protective Film For Xiaomi Smartwatch Huami Amazfit T-Rex T rex Smart Watch Screen Protector Cover Protection,https://www.aliexpress.com/item/4000670749661.html,1.39
Haylou LS01 Global Version 9 Sport Modes Smart Watch for Android ios Fashion Comfortable Women Men Sleep Management Smartwatch,https://www.aliexpress.com/item/4000505523770.html,26.91
New Amazfit Stratos 3 GPS smartwatch 5ATM Bluetooth Music Heart Rate Dual Mode 14 Days Battery For Xiaomi 2019,https://www.aliexpress.com/item/4000528550479.html,219.99
18mm 22mm 20mm 24mm Stainless Steel Watch Band Strap Classic quick release For Amazfit T-Rex Rugged,https://www.aliexpress.com/item/4000718570912.html,13.99
Garmin fenix 5/ fenix 5s/ fenix 5x GPS Multisport Smartwatch Triathlon bicycle run swim hiking cycling Watch,https://www.aliexpress.com/item/32889652428.html,549.00
Xiaomi Ticwatch Pro Bluetooth Smart Watch IP68 Waterproof support NFC Payments/Google Assistant Wear OS by Google GPS Watch,https://www.aliexpress.com/item/4000076643517.html,233.99
Milanese Loop Wrist Strap 18mm 20mm 22mm 24mm Stainless Steel Watch Band Bracelet Buckle Belt For Amazfit T-Rex Rugged,https://www.aliexpress.com/item/4000718599433.html,11.99
